{
  "generated_at": "2026-09-18T08:12:52.674564+00:00",
  "source_commit": "0dc55387d912437a34f3dbf6085d13d0f96b2dc6",
  "dependencies": [
    {
      "id": "zwo-asi-camera-sdk",
      "kind": "vendor-sdk",
      "relationship": "direct",
      "current": {
        "note": "version resolved at scan time from the installed SONAME",
        "version": "1.41"
      },
      "usage": {
        "build": true,
        "runtime": true,
        "packaged": true
      },
      "contents": {
        "file_count": 7,
        "total_size_bytes": 15666127,
        "libraries": [
          {
            "path": "lib/linux/armv8/libASICamera2.so",
            "sha256": "3ecf511979ed571131e7d7f4a467112aba21940b4dc91d63bd109b9683bf67c4",
            "size": 4042678,
            "needed": [
              "libusb-1.0.so.0",
              "libstdc++.so.6",
              "libm.so.6",
              "libgcc_s.so.1",
              "libc.so.6"
            ],
            "soname": null,
            "rpath": null
          },
          {
            "path": "lib/linux/armv8/libASICamera2.so.1.41",
            "sha256": "3ecf511979ed571131e7d7f4a467112aba21940b4dc91d63bd109b9683bf67c4",
            "size": 4042678,
            "needed": [
              "libusb-1.0.so.0",
              "libstdc++.so.6",
              "libm.so.6",
              "libgcc_s.so.1",
              "libc.so.6"
            ],
            "soname": null,
            "rpath": null
          }
        ],
        "executables": [
          {
            "path": "lib/linux/asi.rules",
            "sha256": "0e7bbbcd99f56014e0a593416491a9ebf3fce72cd31238dbd657ed4aa62d01c0",
            "size": 213
          }
        ],
        "firmware": {
          "count": 0,
          "aggregate_sha256": null
        },
        "archives": [],
        "licenses": [
          "license.txt"
        ],
        "examples": {
          "present": false,
          "used_by_project": false
        }
      },
      "risks": [
        {
          "code": "precompiled-binary",
          "severity": "medium",
          "acknowledged": true,
          "review_after": "2027-03-18"
        },
        {
          "code": "upstream-signature-unavailable",
          "severity": "medium",
          "acknowledged": true,
          "review_after": "2027-03-18"
        }
      ]
    },
    {
      "id": "zwo-eaf-sdk",
      "kind": "vendor-sdk",
      "relationship": "direct",
      "current": {
        "note": "version resolved at scan time from the installed SONAME",
        "version": "1.7.7"
      },
      "usage": {
        "build": true,
        "runtime": true,
        "packaged": false
      },
      "contents": {
        "file_count": 6,
        "total_size_bytes": 2894680,
        "libraries": [
          {
            "path": "lib/armv8/libEAFFocuser.so",
            "sha256": "0ce25b248a727ec4cad07cc4de4ffeb256773f9bc23794a66a8a527132d5df6d",
            "size": 766816,
            "needed": [
              "libstdc++.so.6",
              "libgcc_s.so.1",
              "libc.so.6",
              "ld-linux-aarch64.so.1"
            ],
            "soname": null,
            "rpath": null
          },
          {
            "path": "lib/armv8/libEAFFocuser.so.1.7.7",
            "sha256": "0ce25b248a727ec4cad07cc4de4ffeb256773f9bc23794a66a8a527132d5df6d",
            "size": 766816,
            "needed": [
              "libstdc++.so.6",
              "libgcc_s.so.1",
              "libc.so.6",
              "ld-linux-aarch64.so.1"
            ],
            "soname": null,
            "rpath": null
          }
        ],
        "executables": [
          {
            "path": "include/EAF_focuser.h",
            "sha256": "2391a9020eea40e3072a9dbfc3359b8dfde8b75f124bb602c7a55d5fd61edc26",
            "size": 27367
          },
          {
            "path": "lib/eaf.rules",
            "sha256": "0a2496843e2409f753b5b82b8580217282cd31958bdf20589a4277df7669debb",
            "size": 108
          },
          {
            "path": "license.txt",
            "sha256": "98ad1c18048bfdabc8463740ac36a8d8cd710bdc3102ac6c22978ec50056e5a2",
            "size": 1095
          }
        ],
        "firmware": {
          "count": 0,
          "aggregate_sha256": null
        },
        "archives": [],
        "licenses": [
          "license.txt"
        ],
        "examples": {
          "present": false,
          "used_by_project": false
        }
      },
      "risks": [
        {
          "code": "precompiled-binary",
          "severity": "medium",
          "acknowledged": true,
          "review_after": "2027-03-18"
        },
        {
          "code": "upstream-signature-unavailable",
          "severity": "medium",
          "acknowledged": true,
          "review_after": "2027-03-18"
        }
      ]
    },
    {
      "id": "zwo-efw-sdk",
      "kind": "vendor-sdk",
      "relationship": "direct",
      "current": {
        "note": "version resolved at scan time from the installed SONAME",
        "version": "1.8.4"
      },
      "usage": {
        "build": true,
        "runtime": true,
        "packaged": false
      },
      "contents": {
        "file_count": 6,
        "total_size_bytes": 181095,
        "libraries": [
          {
            "path": "lib/armv8/libEFWFilter.so",
            "sha256": "100fcfd03a2370c715db3b188710fa619bfab7fb83eb54ea754aad07fdbd328b",
            "size": 53216,
            "needed": [
              "libstdc++.so.6",
              "libgcc_s.so.1",
              "libc.so.6",
              "ld-linux-aarch64.so.1"
            ],
            "soname": null,
            "rpath": null
          },
          {
            "path": "lib/armv8/libEFWFilter.so.1.8.4",
            "sha256": "100fcfd03a2370c715db3b188710fa619bfab7fb83eb54ea754aad07fdbd328b",
            "size": 53216,
            "needed": [
              "libstdc++.so.6",
              "libgcc_s.so.1",
              "libc.so.6",
              "ld-linux-aarch64.so.1"
            ],
            "soname": null,
            "rpath": null
          }
        ],
        "executables": [
          {
            "path": "include/EFW_filter.h",
            "sha256": "c55474d3d8a7fadf9d08575d25807050dcebd3bff29943c9dbe22fbd40a7e76c",
            "size": 10004
          },
          {
            "path": "lib/efw.rules",
            "sha256": "07166fbfee4220bf3d7195e94230ae7d7bd9002fbed69af3f192b9369fc7236f",
            "size": 110
          },
          {
            "path": "license.txt",
            "sha256": "98ad1c18048bfdabc8463740ac36a8d8cd710bdc3102ac6c22978ec50056e5a2",
            "size": 1095
          }
        ],
        "firmware": {
          "count": 0,
          "aggregate_sha256": null
        },
        "archives": [],
        "licenses": [
          "license.txt"
        ],
        "examples": {
          "present": false,
          "used_by_project": false
        }
      },
      "risks": [
        {
          "code": "precompiled-binary",
          "severity": "medium",
          "acknowledged": true,
          "review_after": "2027-03-18"
        },
        {
          "code": "upstream-signature-unavailable",
          "severity": "medium",
          "acknowledged": true,
          "review_after": "2027-03-18"
        }
      ]
    },
    {
      "id": "zwo-caa-sdk",
      "kind": "vendor-sdk",
      "relationship": "direct",
      "current": {
        "note": "version resolved at scan time from the installed SONAME",
        "version": "1.5.9"
      },
      "usage": {
        "build": true,
        "runtime": true,
        "packaged": false
      },
      "contents": {
        "file_count": 6,
        "total_size_bytes": 1415592,
        "libraries": [
          {
            "path": "lib/armv8/libCAA.so",
            "sha256": "680286a000d203883fc626e1ea4d4addadf5d93e940c33135a7ee20d98abe901",
            "size": 393248,
            "needed": [
              "libstdc++.so.6",
              "libgcc_s.so.1",
              "libc.so.6",
              "ld-linux-aarch64.so.1"
            ],
            "soname": null,
            "rpath": null
          },
          {
            "path": "lib/armv8/libCAA.so.1.5.9",
            "sha256": "680286a000d203883fc626e1ea4d4addadf5d93e940c33135a7ee20d98abe901",
            "size": 393248,
            "needed": [
              "libstdc++.so.6",
              "libgcc_s.so.1",
              "libc.so.6",
              "ld-linux-aarch64.so.1"
            ],
            "soname": null,
            "rpath": null
          }
        ],
        "executables": [
          {
            "path": "include/CAA_API.h",
            "sha256": "cacf58d33ccc1911fd6f7788b62cac0ec8284729ea24942f988bb089d972e697",
            "size": 14347
          },
          {
            "path": "lib/caa.rules",
            "sha256": "b1570b3678872fd8bd63e2ad8ad9ae3371a8a45fbfa66ce5f05346c28ff15534",
            "size": 118
          },
          {
            "path": "license.txt",
            "sha256": "98ad1c18048bfdabc8463740ac36a8d8cd710bdc3102ac6c22978ec50056e5a2",
            "size": 1095
          }
        ],
        "firmware": {
          "count": 0,
          "aggregate_sha256": null
        },
        "archives": [],
        "licenses": [
          "license.txt"
        ],
        "examples": {
          "present": false,
          "used_by_project": false
        }
      },
      "risks": [
        {
          "code": "precompiled-binary",
          "severity": "medium",
          "acknowledged": true,
          "review_after": "2027-03-18"
        },
        {
          "code": "upstream-signature-unavailable",
          "severity": "medium",
          "acknowledged": true,
          "review_after": "2027-03-18"
        }
      ]
    },
    {
      "id": "qhy-sdk",
      "kind": "vendor-sdk",
      "relationship": "direct",
      "current": {
        "version": "26.06.04",
        "path": "AlpacaCore/external/QHY/sdk_linux_arm64_26.06.04"
      },